### ISSUE TITLE
POW出块，数据停止同步，且getblockcount和listpeer命令返回的结果有很大偏差

### ISSUE THREAD

**Issue by chajiubu** [bigbangcore/BigBang#62]
**准备条件**：开了两台机器，一台windows一台Linux，其中windows配置了POW出块，Linux没有配置POW出块，gateway设置为空

**现象**：数据停止同步，bigbang程序没有停止，但日志不再打印也不再写入文件，通过getblockcount和listpeer命令返回的结果有很大偏差，且两台机器通过getblockcount获得的区块数量都停留在了同一个区块高度。stop后再次启动bigbang，数据重新开始同步，一切恢复正常

**出现次数**：多次测试，反复出现

**Comment by shangqd** [comment]
01:11:25.892541 IP 192.168.0.106.56064 > 18.139.37.48.9903: Flags [P.], seq 3694:3779, ack 15006, win 750, options [nop,nop,TS val 3951712939 ecr 2216370029], length 85
01:11:25.983496 IP 18.139.37.48.9903 > 192.168.0.106.56064: Flags [P.], seq 15006:15454, ack 3779, win 341, options [nop,nop,TS val 2216370053 ecr 3951712939], length 448
01:11:26.024267 IP 192.168.0.106.56064 > 18.139.37.48.9903: Flags [.], ack 15454, win 773, options [nop,nop,TS val 3951713030 ecr 2216370053], length 0
01:12:25.471764 IP 18.139.37.48.9903 > 192.168.0.106.56064: Flags [P.], seq 15454:15539, ack 3779, win 341, options [nop,nop,TS val 2216384921 ecr 3951713030], length 85
01:12:25.471788 IP 192.168.0.106.56064 > 18.139.37.48.9903: Flags [.], ack 15539, win 773, options [nop,nop,TS val 3951772519 ecr 2216384921], length 0
01:13:18.535342 IP 18.139.37.48.9903 > 192.168.0.106.56064: Flags [P.], seq 15539:15624, ack 3779, win 341, options [nop,nop,TS val 2216398185 ecr 3951772519], length 85
01:13:18.535351 IP 192.168.0.106.56064 > 18.139.37.48.9903: Flags [.], ack 15624, win 773, options [nop,nop,TS val 3951825584 ecr 2216398185], length 0
01:15:42.614150 IP 18.139.37.48.9903 > 192.168.0.106.56064: Flags [P.], seq 15624:15709, ack 3779, win 341, options [nop,nop,TS val 2216434205 ecr 3951825584], length 85
01:15:42.614164 IP 192.168.0.106.56064 > 18.139.37.48.9903: Flags [.], ack 15709, win 773, options [nop,nop,TS val 3951969665 ecr 2216434205], length 0
01:17:20.664308 IP 18.139.37.48.9903 > 192.168.0.106.56064: Flags [P.], seq 15709:15794, ack 3779, win 341, options [nop,nop,TS val 2216458721 ecr 3951969665], length 85
01:17:20.664329 IP 192.168.0.106.56064 > 18.139.37.48.9903: Flags [.], ack 15794, win 773, options [nop,nop,TS val 3952067718 ecr 2216458721], length 0
01:17:20.784912 IP 192.168.0.106.56064 > 18.139.37.48.9903: Flags [P.], seq 3779:3864, ack 15794, win 773, options [nop,nop,TS val 3952067838 ecr 2216458721], length 85
01:17:20.938276 IP 18.139.37.48.9903 > 192.168.0.106.56064: Flags [.], ack 3864, win 341, options [nop,nop,TS val 2216458785 ecr 3952067838], length 0
01:18:41.060102 IP 18.139.37.48.9903 > 192.168.0.106.56064: Flags [P.], seq 15794:15879, ack 3864, win 341, options [nop,nop,TS val 2216478817 ecr 3952067838], length 85
01:18:41.060131 IP 192.168.0.106.56064 > 18.139.37.48.9903: Flags [.], ack 15879, win 773, options [nop,nop,TS val 3952148115 ecr 2216478817], length 0
01:21:20.130634 IP 18.139.37.48.9903 > 192.168.0.106.56064: Flags [P.], seq 15879:15964, ack 3864, win 341, options [nop,nop,TS val 2216518582 ecr 3952148115], length 85
01:21:20.130643 IP 192.168.0.106.56064 > 18.139.37.48.9903: Flags [.], ack 15964, win 773, options [nop,nop,TS val 3952307189 ecr 2216518582], length 0
01:22:13.333266 IP 18.139.37.48.9903 > 192.168.0.106.56064: Flags [P.], seq 15964:16049, ack 3864, win 341, options [nop,nop,TS val 2216531885 ecr 3952307189], length 85
01:22:13.333288 IP 192.168.0.106.56064 > 18.139.37.48.9903: Flags [.], ack 16049, win 773, options [nop,nop,TS val 3952360392 ecr 2216531885], length 0
01:22:13.333542 IP 192.168.0.106.56064 > 18.139.37.48.9903: Flags [P.], seq 3864:3949, ack 16049, win 773, options [nop,nop,TS val 3952360392 ecr 2216531885], length 85
01:22:13.436013 IP 18.139.37.48.9903 > 192.168.0.106.56064: Flags [.], ack 3949, win 341, options [nop,nop,TS val 2216531911 ecr 3952360392], length 0
01:22:13.436344 IP 18.139.37.48.9903 > 192.168.0.106.56064: Flags [P.], seq 16049:16497, ack 3949, win 341, options [nop,nop,TS val 2216531911 ecr 3952360392], length 448
01:22:13.480269 IP 192.168.0.106.56064 > 18.139.37.48.9903: Flags [.], ack 16497, win 795, options [nop,nop,TS val 3952360495 ecr 2216531911], length 0
01:23:08.633024 IP 18.139.37.48.9903 > 192.168.0.106.56064: Flags [P.], seq 16497:16582, ack 3949, win 341, options [nop,nop,TS val 2216545709 ecr 3952360495], length 85
01:23:08.633095 IP 192.168.0.106.56064 > 18.139.37.48.9903: Flags [.], ack 16582, win 795, options [nop,nop,TS val 3952415693 ecr 2216545709], length 0
01:25:14.445332 IP 18.139.37.48.9903 > 192.168.0.106.56064: Flags [P.], seq 16582:16667, ack 3949, win 341, options [nop,nop,TS val 2216577161 ecr 3952415693], length 85
01:25:14.445350 IP 192.168.0.106.56064 > 18.139.37.48.9903: Flags [.], ack 16667, win 795, options [nop,nop,TS val 3952541508 ecr 2216577161], length 0
01:25:14.516773 IP 192.168.0.106.56064 > 18.139.37.48.9903: Flags [P.], seq 3949:4034, ack 16667, win 795, options [nop,nop,TS val 3952541579 ecr 2216577161], length 85
01:25:14.661764 IP 18.139.37.48.9903 > 192.168.0.106.56064: Flags [.], ack 4034, win 341, options [nop,nop,TS val 2216577216 ecr 3952541579], length 0
01:26:08.687755 IP 18.139.37.48.9903 > 192.168.0.106.56064: Flags [P.], seq 16667:16752, ack 4034, win 341, options [nop,nop,TS val 2216590722 ecr 3952541579], length 85
01:26:08.687782 IP 192.168.0.106.56064 > 18.139.37.48.9903: Flags [.], ack 16752, win 795, options [nop,nop,TS val 3952595751 ecr 2216590722], length 0
01:26:08.688017 IP 192.168.0.106.56064 > 18.139.37.48.9903: Flags [P.], seq 4034:4119, ack 16752, win 795, options [nop,nop,TS val 3952595752 ecr 2216590722], length 85
01:26:08.798301 IP 18.139.37.48.9903 > 192.168.0.106.56064: Flags [.], ack 4119, win 341, options [nop,nop,TS val 2216590748 ecr 3952595752], length 0
01:26:08.798536 IP 18.139.37.48.9903 > 192.168.0.106.56064: Flags [P.], seq 16752:17200, ack 4119, win 341, options [nop,nop,TS val 2216590748 ecr 3952595752], length 448
01:26:08.840270 IP 192.168.0.106.56064 > 18.139.37.48.9903: Flags [.], ack 17200, win 818, options [nop,nop,TS val 3952595862 ecr 2216590748], length 0
01:28:13.812769 IP 18.139.37.48.9903 > 192.168.0.106.56064: Flags [P.], seq 17200:17285, ack 4119, win 341, options [nop,nop,TS val 2216622002 ecr 3952595862], length 85
01:28:13.812779 IP 192.168.0.106.56064 > 18.139.37.48.9903: Flags [.], ack 17285, win 818, options [nop,nop,TS val 3952720879 ecr 2216622002], length 0
01:30:41.954938 IP 18.139.37.48.9903 > 192.168.0.106.56064: Flags [P.], seq 17285:17370, ack 4119, win 341, options [nop,nop,TS val 2216659039 ecr 3952720879], length 85
01:30:41.954960 IP 192.168.0.106.56064 > 18.139.37.48.9903: Flags [.], ack 17370, win 818, options [nop,nop,TS val 3952869024 ecr 2216659039], length 0
01:30:41.955189 IP 192.168.0.106.56064 > 18.139.37.48.9903: Flags [P.], seq 4119:4204, ack 17370, win 818, options [nop,nop,TS val 3952869024 ecr 2216659039], length 85
01:30:42.055040 IP 18.139.37.48.9903 > 192.168.0.106.56064: Flags [P.], seq 17370:17818, ack 4204, win 341, options [nop,nop,TS val 2216659064 ecr 3952869024], length 448
01:30:42.096274 IP 192.168.0.106.56064 > 18.139.37.48.9903: Flags [.], ack 17818, win 840, options [nop,nop,TS val 3952869124 ecr 2216659064], length 0
01:32:00.738796 IP 18.139.37.48.9903 > 192.168.0.106.56064: Flags [P.], seq 17818:17903, ack 4204, win 341, options [nop,nop,TS val 2216678732 ecr 3952869124], length 85
01:32:00.738822 IP 192.168.0.106.56064 > 18.139.37.48.9903: Flags [.], ack 17903, win 840, options [nop,nop,TS val 3952947809 ecr 2216678732], length 0
01:32:58.888404 IP 18.139.37.48.9903 > 192.168.0.106.56064: Flags [P.], seq 17903:17988, ack 4204, win 341, options [nop,nop,TS val 2216693274 ecr 3952947809], length 85
01:32:58.888418 IP 192.168.0.106.56064 > 18.139.37.48.9903: Flags [.], ack 17988, win 840, options [nop,nop,TS val 3953005960 ecr 2216693274], length 0
01:32:58.982927 IP 192.168.0.106.56064 > 18.139.37.48.9903: Flags [P.], seq 4204:4289, ack 17988, win 840, options [nop,nop,TS val 3953006055 ecr 2216693274], length 85
01:32:59.128472 IP 18.139.37.48.9903 > 192.168.0.106.56064: Flags [.], ack 4289, win 341, options [nop,nop,TS val 2216693331 ecr 3953006055], length 0
01:33:53.536072 IP 18.139.37.48.9903 > 192.168.0.106.56064: Flags [P.], seq 17988:18073, ack 4289, win 341, options [nop,nop,TS val 2216706934 ecr 3953006055], length 85
01:33:53.536092 IP 192.168.0.106.56064 > 18.139.37.48.9903: Flags [.], ack 18073, win 840, options [nop,nop,TS val 3953060609 ecr 2216706934], length 0
01:35:20.693558 IP 18.139.37.48.9903 > 192.168.0.106.56064: Flags [P.], seq 18073:18158, ack 4289, win 341, options [nop,nop,TS val 2216728724 ecr 3953060609], length 85
01:35:20.693567 IP 192.168.0.106.56064 > 18.139.37.48.9903: Flags [.], ack 18158, win 840, options [nop,nop,TS val 3953147768 ecr 2216728724], length 0
01:36:22.665761 IP 18.139.37.48.9903 > 192.168.0.106.56064: Flags [P.], seq 18158:18243, ack 4289, win 341, options [nop,nop,TS val 2216744213 ecr 3953147768], length 85
01:36:22.665779 IP 192.168.0.106.56064 > 18.139.37.48.9903: Flags [.], ack 18243, win 840, options [nop,nop,TS val 3953209741 ecr 2216744213], length 0

10:03:33.838828 IP 192.168.0.106.56064 > 18.139.37.48.9903: Flags [P.], seq 4289:4374, ack 18243, win 840, options [nop,nop,TS val 3983641586 ecr 2216744213], length 85
10:03:34.172265 IP 192.168.0.106.56064 > 18.139.37.48.9903: Flags [P.], seq 4289:4374, ack 18243, win 840, options [nop,nop,TS val 3983641920 ecr 2216744213], length 85
10:03:34.524264 IP 192.168.0.106.56064 > 18.139.37.48.9903: Flags [P.], seq 4289:4374, ack 18243, win 840, options [nop,nop,TS val 3983642272 ecr 2216744213], length 85
10:03:35.196263 IP 192.168.0.106.56064 > 18.139.37.48.9903: Flags [P.], seq 4289:4374, ack 18243, win 840, options [nop,nop,TS val 3983642944 ecr 2216744213], length 85
10:03:36.508269 IP 192.168.0.106.56064 > 18.139.37.48.9903: Flags [P.], seq 4289:4374, ack 18243, win 840, options [nop,nop,TS val 3983644256 ecr 2216744213], length 85
10:03:39.260265 IP 192.168.0.106.56064 > 18.139.37.48.9903: Flags [P.], seq 4289:4374, ack 18243, win 840, options [nop,nop,TS val 3983647008 ecr 2216744213], length 85
10:03:44.636266 IP 192.168.0.106.56064 > 18.139.37.48.9903: Flags [P.], seq 4289:4374, ack 18243, win 840, options [nop,nop,TS val 3983652384 ecr 2216744213], length 85
10:03:55.132272 IP 192.168.0.106.56064 > 18.139.37.48.9903: Flags [P.], seq 4289:4374, ack 18243, win 840, options [nop,nop,TS val 3983662880 ecr 2216744213], length 85
10:04:17.408268 IP 192.168.0.106.56064 > 18.139.37.48.9903: Flags [P.], seq 4289:4374, ack 18243, win 840, options [nop,nop,TS val 3983685157 ecr 2216744213], length 85
10:05:00.412268 IP 192.168.0.106.56064 > 18.139.37.48.9903: Flags [P.], seq 4289:4374, ack 18243, win 840, options [nop,nop,TS val 3983728162 ecr 2216744213], length 85
10:06:24.380273 IP 192.168.0.106.56064 > 18.139.37.48.9903: Flags [P.], seq 4289:4374, ack 18243, win 840, options [nop,nop,TS val 3983812130 ecr 2216744213], length 85
10:08:25.212257 IP 192.168.0.106.56064 > 18.139.37.48.9903: Flags [P.], seq 4289:4374, ack 18243, win 840, options [nop,nop,TS val 3983932958 ecr 2216744213], length 85
10:10:26.044270 IP 192.168.0.106.56064 > 18.139.37.48.9903: Flags [P.], seq 4289:4374, ack 18243, win 840, options [nop,nop,TS val 3984053788 ecr 2216744213], length 85
10:12:26.880277 IP 192.168.0.106.56064 > 18.139.37.48.9903: Flags [P.], seq 4289:4374, ack 18243, win 840, options [nop,nop,TS val 3984174622 ecr 2216744213], length 85
10:14:27.708271 IP 192.168.0.106.56064 > 18.139.37.48.9903: Flags [P.], seq 4289:4374, ack 18243, win 840, options [nop,nop,TS val 3984295449 ecr 2216744213], length 85
10:16:28.540271 IP 192.168.0.106.56064 > 18.139.37.48.9903: Flags [P.], seq 4289:4374, ack 18243, win 840, options [nop,nop,TS val 3984416280 ecr 2216744213], length 85
10:18:29.372274 IP 192.168.0.106.56064 > 18.139.37.48.9903: Flags [P.], seq 4289:4374, ack 18243, win 840, options [nop,nop,TS val 3984537112 ecr 2216744213], length 85

10:21:00.650471 IP 192.168.0.106.58694 > 18.139.37.48.9903: Flags [S], seq 2567939782, win 29200, options [mss 1460,sackOK,TS val 3984688391 ecr 0,nop,wscale 7], length 0

10:21:00.766248 IP 18.139.37.48.9903 > 192.168.0.106.58694: Flags [S.], seq 708023996, ack 2567939783, win 26847, options [mss 1452,sackOK,TS val 2224613760 ecr 3984688391,nop,wscale 7], length 0
10:21:00.766279 IP 192.168.0.106.58694 > 18.139.37.48.9903: Flags [.], ack 1, win 229, options [nop,nop,TS val 3984688507 ecr 2224613760], length 0
10:21:00.766520 IP 192.168.0.106.58694 > 18.139.37.48.9903: Flags [P.], seq 1:80, ack 1, win 229, options [nop,nop,TS val 3984688507 ecr 2224613760], length 79
10:21:00.875921 IP 18.139.37.48.9903 > 192.168.0.106.58694: Flags [.], ack 80, win 210, options [nop,nop,TS val 2224613789 ecr 3984688507], length 0
10:21:00.876167 IP 18.139.37.48.9903 > 192.168.0.106.58694: Flags [P.], seq 1:80, ack 80, win 210, options [nop,nop,TS val 2224613789 ecr 3984688507], length 79
10:21:00.876178 IP 192.168.0.106.58694 > 18.139.37.48.9903: Flags [.], ack 80, win 229, options [nop,nop,TS val 3984688617 ecr 2224613789], length 0
10:21:00.876302 IP 192.168.0.106.58694 > 18.139.37.48.9903: Flags [P.], seq 80:96, ack 80, win 229, options [nop,nop,TS val 3984688617 ecr 2224613789], length 16
10:21:00.986283 IP 18.139.37.48.9903 > 192.168.0.106.58694: Flags [P.], seq 80:96, ack 96, win 210, options [nop,nop,TS val 2224613816 ecr 3984688617], length 16
10:21:00.986303 IP 192.168.0.106.58694 > 18.139.37.48.9903: Flags [P.], seq 96:897, ack 96, win 229, options [nop,nop,TS val 3984688727 ecr 2224613816], length 801
10:21:01.100311 IP 18.139.37.48.9903 > 192.168.0.106.58694: Flags [P.], seq 96:881, ack 897, win 223, options [nop,nop,TS val 2224613844 ecr 3984688727], length 785
10:21:01.100337 IP 192.168.0.106.58694 > 18.139.37.48.9903: Flags [P.], seq 897:1077, ack 881, win 251, options [nop,nop,TS val 3984688841 ecr 2224613844], length 180
10:21:01.100534 IP 18.139.37.48.9903 > 192.168.0.106.58694: Flags [.], seq 881:5201, ack 897, win 223, options [nop,nop,TS val 2224613844 ecr 3984688727], length 4320

**Comment by shangqd** [comment]
截获了一段通信日志，好好的分析下

**Comment by chajiubu** [comment]
[问题已解决，通过增加心跳功能实现](https://github.com/bigbangcore/BigBang/tree/Internal0.9.1)：https://github.com/bigbangcore/BigBang/tree/Internal0.9.1

**Comment by chajiubu** [comment]
关于“getblockcount和listpeer命令返回的结果有很大偏差”的问题，是因为listpeer命令返回的高度是在握手的时候获得的，一次握手后该数据不再变化，所以会有较大偏差。这里将来会改进。
